transcription,sentiment_majoritaire,confiance
j'ai pensé à par femme en triste quand je change de de bodo,,1.0
alors si je me considère chanceuse satrape le travail et j'avais exercé au situee,,1.0
franchement je vois tes sales parti et pourquoi te change pas de le travail du ville tu la possèdes,,1.0
mais non en fait avec ma ni expérience est-ce que j'ai changé de travail avec plusieurs sociétés,,1.0
ancien peu ses pas le même environnement tout d'abord,,1.0
a cette fin peu semblable celi que j'exerce nettement,,1.0
a cette fin peu semblable celi que j'exerce nettement,,1.0
alors si je me considère chanceuse satrape le travail et j'avais exercé au situee,,1.0
